{
  "id": "nisi ea reprehenderit",
  "paymentMethodStatus": "sed consequat consectetur in",
  "secondaryScanCodeLabel": "fugiat commodo nostrud ipsum do",
  "couponStatus": "enim",
  "manufacturer": [
    "Ut est proident sint"
  ],
  "couponCount": null,
  "primaryScanCodeLabel": "do esse ut non dolor"
}
